{
  "$schema": "../../schemas/npc_def_schema.json",
  "id": "hazel",
  "displayName": "Hazel",
  "width": 32,
  "height": 64,
  "animationKey": "npc_hazel",
  "dialogueTreeId": "hazel_act0",
  "isQuestGiver": true,
  "isShop": false,
  "isBoss": false,
  "hubPresenceByState": {
    "FULL": true,
    "CORRUPTED": true,
    "EMPTY": false,
    "FRACTURED": false,
    "RECOVERING": false,
    "WHOLE": false
  }
}
