{
  "$schema": "../../schemas/npc_def_schema.json",
  "id": "mission_giver",
  "displayName": "Mission Giver",
  "width": 32,
  "height": 64,
  "animationKey": "npc_mission_giver",
  "dialogueTreeId": "mission_giver_main",
  "isQuestGiver": true,
  "isShop": false,
  "isBoss": false,
  "hubPresenceByState": {
    "FULL": true,
    "CORRUPTED": false,
    "EMPTY": false,
    "FRACTURED": false,
    "RECOVERING": true,
    "WHOLE": true
  }
}
