{
  "$schema": "../../schemas/npc_def_schema.json",
  "id": "lore_keeper",
  "displayName": "Lore Keeper",
  "width": 32,
  "height": 64,
  "animationKey": "npc_lore_keeper",
  "dialogueTreeId": "lore_keeper_main",
  "isQuestGiver": false,
  "isShop": false,
  "isBoss": false,
  "hubPresenceByState": {
    "FULL": true,
    "CORRUPTED": false,
    "EMPTY": false,
    "FRACTURED": false,
    "RECOVERING": true,
    "WHOLE": true
  }
}
